{
  "schema_version": "1.0.0",
  "simulated": true,
  "report_id": "sim-incident-001",
  "provider_call_id": "sim-call-001",
  "version": 1,
  "created_at": "2026-10-23T18:00:10Z",
  "updated_at": "2026-10-23T18:00:10Z",
  "transcript": [
    {
      "turn_id": "turn-001",
      "speaker": "assistant",
      "recorded_at": "2026-10-23T18:00:00Z",
      "text": "This is a FloodLine simulation. Please describe the fictional flooding and its location."
    },
    {
      "turn_id": "turn-002",
      "speaker": "caller",
      "recorded_at": "2026-10-23T18:00:08Z",
      "text": "For this simulation, water is rising inside our building on Juniper Lane in fictional Millhaven."
    }
  ],
  "summary": {
    "text": "Simulated caller reports rising water inside a building on Juniper Lane in fictional Millhaven. Exact address and people affected are unknown.",
    "generated_by": "model",
    "source_turn_ids": [
      "turn-002"
    ]
  },
  "reported_location": {
    "description": "Juniper Lane, fictional Millhaven",
    "precision": "street",
    "source_turn_ids": [
      "turn-002"
    ]
  },
  "people_affected": {
    "count": null,
    "includes_children": null,
    "source_turn_ids": []
  },
  "hazards": {
    "rising_water": true,
    "fast_moving_water": null,
    "trapped_people": null,
    "electrical_danger": null,
    "source_turn_ids": [
      "turn-002"
    ]
  },
  "unknown_fields": [
    {
      "field": "/reported_location/coordinates",
      "reason": "not_available",
      "source_turn_ids": []
    },
    {
      "field": "/people_affected/count",
      "reason": "not_asked",
      "source_turn_ids": []
    },
    {
      "field": "/people_affected/includes_children",
      "reason": "not_asked",
      "source_turn_ids": []
    },
    {
      "field": "/hazards/fast_moving_water",
      "reason": "not_asked",
      "source_turn_ids": []
    },
    {
      "field": "/hazards/trapped_people",
      "reason": "not_asked",
      "source_turn_ids": []
    },
    {
      "field": "/hazards/electrical_danger",
      "reason": "not_asked",
      "source_turn_ids": []
    }
  ],
  "review_status": "pending_review",
  "revisions": [
    {
      "version": 1,
      "recorded_at": "2026-10-23T18:00:10Z",
      "kind": "created",
      "changed_fields": [
        "/provider_call_id",
        "/transcript",
        "/summary",
        "/reported_location",
        "/people_affected",
        "/hazards",
        "/unknown_fields",
        "/review_status"
      ],
      "source_turn_ids": [
        "turn-002"
      ],
      "note": "Created a fictional simulation report from the initial caller statement."
    }
  ]
}
